Text,Language
Utilise the available resources to make a difference.,English
Ninety per cent of Uganda's population feed on agricultural produce.,English
Resources like land could be used for farming activities.,English
"In commercial agriculture, farmers sell their produce to get money.",English
How can one adequatery prepare for his old age?,English
Teachers leave their profession because of low salaries.,English
Large scale farmers are encouraged to adapt to modern farming techniques.,English
Wealth is accumulated from existing resources.,English
Religious leaders should encourage their people to work.,English
Fake products should be banned from the market.,English
What are some of the renewable energy products?,English
We have successfully done market research for our new product.,English
Marketing campaigns widen the market for the products.,English
Companies can integrate at their own risk.,English
Warranties are given to customers after making a purchase.,English
The poor and the rich have different mentalities.,English
Why do people have to be sceptical while buying products?,English
Buyers are concerned about the quality of the products.,English
People working together don't have to be friends.,English
Fake products can not last long on the market.,English
Those faking products need to be arrested.,English
Some companies do produce quality products.,English
Corruption is a vice in the community.,English
Students are encouraged in school not to be corrupt when they grow up.,English
Teachers influence their students and pupils.,English
Your actions terl us the kind of person you are.,English
The health centres are inadequate.,English
There is a need to employ more doctors in the village health centre.,English
The hospital recruited more doctors.,English
The doctors have no staff quarters.,English
Patients were requested to buy food while in the hospital.,English
All the hospital wards were full.,English
There were no more wards to admit patients to.,English
The officials read the bill yesterday.,English
The security officials live in a damaged house.,English
We need more midwives in Uganda.,English
Bricks were purchased to construct a new clinic.,English
The bricks have not been paid for yet.,English
The community should fundraise for hospital construction.,English
The damaged house was renovated.,English
Water is a basic need for everyone.,English
Many people have no access to safe water.,English
People can fetch water from the wells.,English
Not all parts of Uganda receive a lot of rainfall.,English
well s are not perfectly gazetted.,English
Water from the springs is very safe.,English
Water is used for domestic work.,English
Buying water is quite costly.,English
They fetch water from the borehole.,English
People were complaining about water shortage in that area.,English
Some people fall in rivers and die.,English
Her son drowned in a swimming pool.,English
There is a need to create more water sources.,English
More well s are being constructed for ease of access to safe water.,English
We should boil water before drinking it.,English
We should wash our hands regularly.,English
People complained about the high costs of water.,English
The water standard of cleanliness was still lacking.,English
People were sensitized about sanitation.,English
The are many water-borne diseases.,English
Several families now have access to clean water.,English
We are advised to boil water before drinking it.,English
They constructed a borehole for the village settlers.,English
We should maintain water sanitation.,English
Many Ugandans have no access to clean water.,English
More people can now access clean water.,English
All the candidates belonged to a political party.,English
He has posted about the situation.,English
Many people are joining social media these days.,English
All the presidential candidates picked nomination forms today.,English
We were advised to reference our work.,English
The company called for job applications.,English
The campaign season has started.,English
The leaders attended a team-building workshop.,English
The sub-county residents voted their leader.,English
They complained about corrupt leaders.,English
Leaders are accountable to their voters.,English
There is a land wrangle in our village.,English
There are family disputes everywhere.,English
The news anchors arrived at the scene late.,English
Religious leaders should be respected.,English
They organized a memorial service for the late priest.,English
A priest should guide and counser the community.,English
That family owns a lot of property.,English
They have started up a new orphanage.,English
People should be sensitized about land ownership.,English
They told us to register all our property.,English
People should avoid grabbing property that doe not belong to them.,English
He was advised to go and repent.,English
They were told to mind their business.,English
They were arrested for theft.,English
I want to buy a car this year.,English
The community was sensitized about land ownership.,English
Everyone should register their land with the local council.,English
Many people are offering moral support to children.,English
His son inherited all his property.,English
The judge asked for my opinion about the land.,English
His family warmly welcomed him back from abroad.,English
He was happy to see his sister.,English
People walked long distances during the lockdown.,English
People should avoid cutting down trees.,English
They advised me to use herbal medicine.,English
Deforestation should be avoided.,English
Everyone should engage in planting trees.,English
The shoes were too big for her.,English
She hit her toe while walking to the garden.,English
People were surprised about my good grades.,English
The chairman advised us to plant more trees.,English
People sell tree seedlings.,English
Everyone was so tired when we arrived.,English
It rained the whole day.,English
We suffered to find accommodation.,English
There were very many people at the political rally.,English
The president pledged to sponsor the planting of more trees.,English
The village chairman died last week.,English
He was shot dead.,English
No one knows why he was shot.,English
Investigations about the cause of his death are being done.,English
Many people have bank loans.,English
The chairman said they needed some financial support as a village.,English
People have started up saving groups.,English
Many people joined our saving group last month.,English
The saving group will be officially launched tomorrow.,English
The president attended the saving group launch.,English
Many women are single mothers.,English
She was imprisoned for failing to pay the loan.,English
Teachers should instil patriotism in their students.,English
Headteachers met to discuss how they improve the education sector.,English
People engaged in all forms of corruption should be heavily punished.,English
People engaged in corruption have been arrested tried and charge.,English
The commissioner explained that schools should make sure they complete the syllabus.,English
Students are over examined while at school.,English
Arua hosted over two thousand five hundred headteachers.,English
The teachers were congested in the hall.,English
The organisers should have found a better place to accommodate the headteachers.,English
The permanent secretary addressed the meeting in the ministry of Education.,English
The catholic church will provide gloves to the priests amidst the Ebola outbreak.,English
The diocese had to engage in the fight against ebola.,English
The gloves will help the priests not to succumb to the ebola virus.,English
The diocese has put up measures to keep the virus away from churches.,English
The church sensitized people to desist from shaking hands.,English
The diocese has established handwashing terminals at every church.,English
The diocese will provide gloves to the cerebrants when necessary.,English
The priests will wear gloves during confirmation: baptism and holy communion.,English
The priests should wear gloves because they get into contact with the people.,English
A priest claims that putting on gloves is null and void in the faith.,English
The catholic faith builds its churches on hills.,English
The priests have their trust in the power of God to protect them.,English
Priests should not fear surrendering the body of Christ to an infected person.,English
There should be other alternatives other than giving priests gloves.,English
The idea of giving priests gloves is unpopular among the people.,English
A police officer was murdered in Arua district.,English
The police have a duty of protecting people during the riots.,English
The police should increase security in the area.,English
The police are authorised to close out the police posts.,English
The police have authority over the police posts.,English
The police will deploy more officers on the police posts.,English
The thieves took the gun from the policeman after killing him.,English
The police station was closed after the murder of a policeman.,English
The chairman announced the deployment of more security forces in the night.,English
The police station is very far from the community.,English
The police assured people of order and stability in the area.,English
Chairpersons should be involved in crime prevention programs.,English
The police will involve people in security programs around the area.,English
People should not be worried because the essential posts are still open.,English
People were informed to desist from buying stolen items.,English
Mothers in Arua launched a cooperative Union.,English
The cooperative has twenty-three thousand members.,English
The chairperson of the cooperative explained that they had set the launch date already.,English
All people in the region were invited to attend the ceremony.,English
The members will learn new techniques and business management skills.,English
Every group receives five million shillings every year.,English
Some groups borrow money from the cooperative.,English
Registration to join the group is at fifty thousand shillings only.,English
People should attend the meeting to acquire knowledge in business management.,English
People joined the group to improve their standards of living.,English
People have borrowed money and established businesses across the region.,English
People have improved their werfare and family well being.,English
Mothers received capital from the cooperative society to boost their businesses.,English
Mothers are given enough time to repay the loans.,English
The headteacher has failed to uphold the standards of the schools.,English
"The headteacher has failed to recruit, monitor and evaluate teachers performances.",English
Teachers are not committed to providing knowledge to the learners.,English
"Headteachers are always absent, which leads to poor performances in schools.",English
Headteachers have failed to coordinate activities at school.,English
The district education officer should set up reforms in the schools.,English
Headteachers with poor performances should be demoted or transferred.,English
The council is not effective because it failed to execute council resolutions.,English
Some headteachers are incompetent and cannot manage the schools.,English
Students are performing poorly.,English
Teachers are absentees who cannot properly plan for their lessons.,English
Students sit for exams when they are not yet ready.,English
Headteachers do not monitor and coordinate school activities.,English
Parents have neglected the performance of their children.,English
"The officials, parents, headteachers, should all be blamed for poor performances.",English
School committees and leaders have not reported the irregularities to the district.,English
Children perform poorly because they are poorly fed at home.,English
The ministry of finance introduced an integrated financial management system in Arua.,English
"The system is efficient and effective, which will improve service delivery.",English
Arua regional centre will be established in Arua district.,English
The financial management system regulates incomes and expenditures.,English
"The treasury service centres are for agencies, local governments and government projects.",English
The treasury centre lacks enough officers to run the day to day activities.,English
Service centres were created to extend services to the people.,English
Service centres will ease accessibility for the local government officials.,English
The management system has to be decentralized to every district in the country.,English
Government is yet to install the system in forty-eight local governments.,English
The system is of the latest technology and run by computer literates.,English
The ministry has advocated for the use of saterlites in areas with the poor network.,English
Some areas are having network challenges which bring about ineffectiveness.,English
The presidential representative in Arua informed the bureaucrats to install the system.,English
There should be proper financial management at the district level,English
The financial management system regulates the activities of government agencies.,English
The government will provide land and tax holidays to local investors.,English
The minister explained that Ugandans are also investors.,English
The minister explained that the government should encourage local investment.,English
The minister was monitoring the ongoing constructions in Koboko municipality.,English
The government will provide tax incentives to the construction company.,English
The construction company is locally based and is doing genuine work.,English
The government will provide incentives to the company to expand to the districts.,English
The government will create a stable and working environment for local investors.,English
The establishment of infrastructures will provide employment opportunities for the people.,English
Good infrastructure will encourage people to engage in business activities.,English
The government will not charge any taxes to the construction company.,English
The project will stimulate development and increase people's participation in business activities.,English
The district chairman reshuffled the executive because of inefficiencies in service provision.,English
A new council leader was appointed to replace the old one.,English
The district needs a new chairperson.,English
Every district must have an executive committee.,English
A new secretary was appointed for community services.,English
He was made responsible for the technical services.,English
The re-appointment brought concern amongst the leaders.,English
The new leaders are capable of regional development.,English
The new leadership committee proved to be politically balanced.,English
They intend to improve service delivery in the region.,English
Better leaders will lead to regional development.,English
The school has a water leakage problem.,English
The water has damaged the school compound.,English
It is the only government school in the region.,English
The leaders revised the school budget.,English
The school committee will find a solution for the running water.,English
Flooding usually occurs in the rainy season.,English
They failed to fix the flooding problem.,English
The running water caused serious damage to the school.,English
School classrooms were flooded with running water.,English
The school's infrastructure is affected by floods.,English
"The school administrator wrote to the council, but no one replied.",English
The headmaster said he couldn't afford to fix school infrastructure.,English
Construction will start as soon as they receive funds.,English
They received funds to start construction.,English
The leaders were advised to improve refugee settlements.,English
School activities should proceed even if some leaders leave.,English
Refugees should be equipped with skills to help them survive on their own.,English
The trust fund agreed to fund the project.,English
They didn't meet to discuss each others project progress.,English
The project will emphasise on community hygiene.,English
The refugees will attend a skills equipment program.,English
They held quarterly meetings on project progress.,English
There is a big information gap because of the size of the project.,English
Committees were established as a platform for project feedback.,English
The local government chairs the project meetings.,English
The department heads requested for higher allowances.,English
The low allowances made project monitoring difficult.,English
Some project leaders embezzled construction funds.,English
The claimed to send funds using mobile money.,English
They monitored the project to ensure smooth project construction.,English
The project will end after four years.,English
The headteacher invited reporters for a meeting.,English
It is extremery hard to monitor teachers who live outside the school quarters.,English
The school evolved to more permanent structures.,English
New buildings will replace the old school structures.,English
The program will improve refugee access to basic needs.,English
There is a competition for fewer resources in the region.,English
They received funds for community development.,English
The project will cover infrastructural development.,English
The projects are implemented on a community demand-basis.,English
The houses were completed in only six months.,English
The council would like to receive a budget for structural development.,English
They wondered if infrastructural development would improve student performance.,English
The teacher asked if the parents burdened children with house chores.,English
They were advised to guard the new infrastructure jealousy.,English
They provided good hospitality to the visitors.,English
"Uganda always welcomes refugees, unlike its neighbouring countries.",English
The greatest percentage of the pupils were refugees.,English
Uganda receives about ten new refugees per day.,English
They revived the old golf club in their region.,English
The golf club shines in the different competitions.,English
The Uganda tourism board organized the competition.,English
The club excerled in the community tournament.,English
The club took first place in the tournament.,English
Other country teams participated in the tournament.,English
Individuals were thanked for their contribution towards the club.,English
They sponsored the financially unable golfers in the region.,English
They intend to market the golf game in their region.,English
The team was excited that their children enjoyed the game.,English
Selected participants will represent Uganda world-wide.,English
The seniors are preparing to host the golf game.,English
They offered tractor services to maintain the golf course.,English
The administrative officer offered a tractor to fierd maintenance.,English
The club was victorious in the previous golf games.,English
Police posts were temporarily closed in the country.,English
The police officers need to complete training.,English
The posts were closed because of operational reasons.,English
Reproductive health Uganda organized a youth day cerebration.,English
A few policemen were recruited and will start training as soon as possible.,English
The officer died because of a mistake during deployment.,English
Deployment offices will be held accountable for the death of the police officer.,English
The project officer will support young people to stay healthy.,English
Career guidance will be provided for the youth.,English
The government officials blamed the youth for being lazy.,English
The police stations were boosted with more human resources.,English
The leaders were warned against division in the churches.,English
Church leaders should embrace the true values of Christian service.,English
The leaders should use their gifts to transform lives.,English
He preached the gospel on Sunday morning.,English
The council elected a new church leader.,English
The council member was elected as the treasurer.,English
The new leaders will serve for two years.,English
The church leaders play an important role in bringing Christians together.,English
The church has two extra branches.,English
The church has contributed to road construction in the region.,English
Some leaders didn't meet the community's expectations.,English
The church organized a community dialogue in the region.,English
Poor roads affect the growth of businesses.,English
The community dialogue will be held for two weeks.,English
Community residents blamed their bad roads on poor leadership.,English
Roads are being constructed in Uganda.,English
Some complaints are not attended to.,English
Poor roads lead to accidents.,English
"Rains usually flood roads, making them impassable.",English
Poor roads should be improved.,English
Some problems require longterm solutions.,English
Increased income leads to an improved standard of living.,English
Some women intentionally dress poorly to seduce male lecturers.,English
The priest warned men against the act of sexual harassment.,English
Both male and female have equal rights.,English
Ladies should improve the way they dress.,English
What is sexual harassment?,English
Lecturers should only hold professional rerations with their students.,English
Culture helps control immorality.,English
Sexual harassment is different forms.,English
"Given the different backgrounds, we all perceive things differently.",English
Men should respect women.,English
The public needs to be acknowledged on the kinds of sexual harassment.,English
Do not keep quiet over sexual harassment.,English
Victims of harassment have personal reasons for remaining silent.,English
How best can institutions manage sexual harassment?,English
Should politicians get involved in hospital issues?,English
You can become a professional in different professions.,English
What is the role of the chairman of the board?,English
A few people can represent the majority.,English
Patients are some of the hospital stakeholders.,English
Hospitals also are administrativery managed.,English
The past is of less significance today.,English
"For proper management, roles should be distributed to the respective people.",English
The health system needs to be improved.,English
Clinics usually refer patients to bigger hospitals.,English
What are some of the complaints that hospitals have?,English
Organisations are so mindful about the well being of their stakeholders.,English
In what ways can a good investment be propagated?,English
Their master plan is longterm.,English
Modern hospitals provide quality services to their patients.,English
Hospitals are adopting to the existing technology for efficiency purposes.,English
Labour shortage in the hospital might result in congestion.,English
Budgets are drawn for planning purposes.,English
The community members managed to raise funds for the ceremony.,English
The budget reflects estimated expenses.,English
"Tourists support local businesses like hoters, restaurants and more.",English
Uganda has tourism sites that attract tourists.,English
The contestants were mainly females.,English
Beauty pageants were asked how each of them was to develop tourism.,English
Tourism sector attracts foreigners into the country.,English
Every region in Uganda has a tourism site.,English
How do beauty queens contribute to the tourism sector?,English
The private sector is encouraged to invest in tourism.,English
The tourism sector must be developed.,English
Government officials are so fond of being involved in land scams.,English
Land matters are a big issue in our society today.,English
Court settles land disputes.,English
Law practitioners legally help the public in different ways.,English
Forests are planted on a large scale.,English
Forests reserves are in more than one location.,English
Private investors plant forests for commercial purposes.,English
Radio stations are one of the sources of information to the public.,English
Government officials are usually unfaithful in performing their duties.,English
Some people tend to individualise government property.,English
What is the role of the national forest authority in Uganda?,English
Community land theft is common.,English
National forest authority needs to acknowledge the public about its duties.,English
Investigations are needed to prove that the case actually happened.,English
Justice must be fair.,English
"Before a judgement is passed in court, both sides have to be heard.",English
Corruption is rampant in government organisations.,English
Wetlands and forest areas are not supposed to be settlement areas.,English
Crops like rice are grown in wetlands.,English
Universities in an area are of great benefit.,English
Reserved areas should not be tampered with.,English
Do not encroach on forest land.,English
Forests should be protected against intruders.,English
Why should foreigners be treated differently from nationals?,English
How can the economy be boosted?,English
Large scale farmers employ machinery on their farms.,English
Small scale farmers can merge.,English
A set up can easily be implemented.,English
What attracts investors in an area?,English
Should we save for the future?,English
Heavy machinery consumes a lot of electricity.,English
Dams help in power generation.,English
Good roads alone cannot lead to development.,English
Foreign investors lead to increased creativity and innovations.,English
His feedback greatly motivated me to work harder.,English
