Text,Language
The residents in the community also take part in the charcoal trade.,English
The government has put up strict rules to prohibit cutting down of trees.,English
Local leaders have urged the community to conserve the environment.,English
We get fruits from some species of trees.,English
There is an increase in the number of refugees coming into Uganda.,English
The government increased the funds allocated to the health sector.,English
The president was the guest of honor at the opening of the midwifery school.,English
Students are advised to take on science subjects.,English
The woman leader established the midwifery school.,English
It is important for a doctor to develop a connection to his patients.,English
The community is happy for completion of the midwifery school.,English
The government should reduce the number of members of parliament and increase their salaries.,English
The president refused the increase in salary of some government officials.,English
I gave my learners an exam of Friday,English
Our country registered a decline in infant and maternal rates.,English
The government has given bursaries to the best performing students.,English
The political party is focusing on improving employment opportunities among the youth.,English
The village leader offered land for the construction of the school.,English
Construction of the bridge will ease the movement of goods in the district.,English
The bridge will link people and trade activities from different areas.,English
The bridge will also help in the economic development of the area.,English
There will be improvement of trade in the neighboring countries.,English
The district leaders had a meeting about the construction of infrastructures in the district.,English
The government has approved the construction of the bridge.,English
It is very expensive to repair a broken down ferry.,English
The ferry has limited time of movement.,English
The bridge construction offered job opportunities for some people in the community.,English
The leaders are yearning for the government to help in the construction of the bridge.,English
The leaders are making plans in finding ways to end poverty in all forms everywhere.,English
There are people who lost their lives due to wars and political conflict.,English
I thank you all for coming to celebrate God's grace that saved my life.,English
We have always lived in peace and harmony in our community.,English
Disputes should be settled peacefully among residents.,English
She accused her neighbor of bewitching her.,English
The opposition leader was manhandled during the arrest.,English
Everyone thought he was dead.,English
It is by God's grace that he is still alive.,English
There is tight security at the country's border points.,English
Early marriages hinder the education of the girl child in the community.,English
There are cattle rustlers in the Northern part of Uganda.,English
The President has fulfilled his pledge towards the construction of new markets in the country.,English
The two women leaders narrowly survived death.,English
The deceased has an unknown identity.,English
The police examined the deceased body to make a medical report.,English
There is an increase in road accidents in Nebbi district.,English
Drivers should avoid speeding.,English
People failed to identify the body of the deceased.,English
The body will be buried at the public cemetery.,English
The police announced on radio stations for people to identify the body.,English
There is corruption among district officials.,English
The cattle provided by the government to the people were stolen.,English
Leaders slaughtered the cattle for meat.,English
People did not receive the cattle provided by the government.,English
The police are carrying out investigations to recover the stolen cattle.,English
The people provided intelligence information regarding the whereabouts of the cattle.,English
The councilor was arrested.,English
Leaders sold the animals to the people.,English
The police was able to recover the animals.,English
The councilor sold the animals to non-beneficiaries.,English
The district leaders are greedy and selfish.,English
Corrupt people will be arrested.,English
The councilor was given a police bond.,English
The councilor provided the cows to his voters.,English
Parents have insufficient funds to take their children to school.,English
Pupils are performing well in the primary leaving examinations.,English
The district should support the vulnerable people.,English
Schools should provide bursaries and sponsorships to bright students.,English
Women have participated in trading.,English
Parents lack funds to sustain their families.,English
Some men abandoned their families.,English
The government will provide sponsorships to the vulnerable people.,English
Teachers are well paid in schools.,English
The school management cut the salaries for the absent teachers.,English
The district is performing well in education at a regional level.,English
The schools will maintain the good performance.,English
The performance among pupils is improving gradually.,English
Teachers do not complete the syllabus.,English
Most of the youths lack jobs.,English
The police will arrest idlers on the streets.,English
People should engage in agricultural activities.,English
The leaders will provide jobs to the youths.,English
People should participate in the development of the society.,English
Men do not provide for their families.,English
Youths spend most of their time in gambling and gaming.,English
Youths gamble to get some money.,English
Most of the youths are orphans.,English
Leaders should work for the people.,English
Youths should be forced to engage in economic activities.,English
Youths engage in criminal activities for example stealing.,English
The government has created the youth livelihood fund for the youth projects.,English
Youths should work hard in order to become useful citizens.,English
Leaders have encouraged afforestation.,English
People who cut down trees were fined.,English
People should understand the significance of trees in the environment.,English
Leaders organized a meeting to respond to the challenges faced by the people.,English
Government should enforce the environment laws.,English
People cut down trees to get timber.,English
The district provided tree seedlings to the people.,English
People cut down trees to get firewood.,English
People sell charcoal and get money.,English
Timber is a source of revenue for the government.,English
Trees act as wind breakers.,English
People demonstrated over the cutting down of shea nut trees.,English
Mothers shunned postnatal care services in Nebbi.,English
Mothers don't go for healthcare services after delivery.,English
Mothers should be concerned about their health and newborn babies.,English
The attendance of mothers for postnatal care is low.,English
Mothers should feed on good food.,English
Mothers should sleep under a treated mosquito net.,English
Mothers should go for antenatal care.,English
Mothers cannot afford postnatal care services.,English
Health workers should be effective in providing health services.,English
Hospitals retain delivery cards to force mothers to return for postnatal care.,English
Mothers think postnatal care services are irrelevant.,English
Mothers are discouraged about postnatal care because no medical checkup is done.,English
Men abandon girls after impregnating them.,English
People are living in extended families.,English
Girls are given empty promises.,English
People lack funds to pay for rent.,English
The district should establish programs for single mothers.,English
Fathers are living in a polygamous way of life.,English
Men should be forced to provide for their families.,English
The police will arrest men who do not support their children.,English
Men have been prosecuted in the courts of law for not providing for their families.,English
The police carried out investigations and the suspect was arrested and charged.,English
Watoto church provided help to the single mothers.,English
Some children were taken to the orphanage.,English
There are increasing cases of teenage pregnancies in the district.,English
There are increasing cases of domestic violence.,English
The district has provided help to the women so that they engage in business.,English
The government has allocated funds towards achieving gender equality.,English
Every district will have a woman member of parliament.,English
The district has provided people with information about legal services.,English
Some people lack shelter.,English
The government will build houses for the people.,English
The local government has low revenue collection.,English
People should desist from the acts of violence.,English
People should work hard and improve their standard of living.,English
People should be sensitized about the dangers of gender based violence.,English
Women have been given safe houses.,English
Women are hardworking.,English
The police barracks in Nebbi got burnt.,English
The cause of the fire outbreak at the police station is still unknown.,English
Police is carrying out investigations to find out the cause of the fire outbreak.,English
Police officers lost their property.,English
The fire gutted the police station for the first time.,English
The fire started in the room of the night duty officer.,English
Officers came to the rescue of their fellow officers.,English
The fire brigade arrived very late.,English
The police headquarters will send relief support to the officers,English
The district organized a forum to promote ethics and integrity among public servants.,English
Leaders should revise the leadership code of conduct.,English
There should be transparency and accountability among leaders.,English
The government should lay anti-corruption strategies to reduce corruption.,English
Leaders should be united.,English
People are still embracing corruption in the country.,English
The forum will instill integrity among public servants.,English
Society should know their role in fighting corruption.,English
Leaders should be committed towards improving service delivery.,English
People should be focused in the fight against corruption.,English
Nebbi district officials want to foster peace and reconciliation among the people.,English
People should work towards achieving rural development.,English
People should be patriotic.,English
People lack the spirit of togetherness.,English
People have conflicted because of land issues.,English
The district should lobby funds from the government to improve service delivery.,English
Cultural leaders encouraged people to stay united.,English
People should respect culture.,English
Cultural leaders sensitized people to support the reconciliation process.,English
District officials will hold a meeting to discuss people's challenges.,English
Nebbi market lacks a public toilet.,English
People use the toilets in the neighborhood.,English
There is improper sanitation in the area.,English
The district should establish the toilet in the trading centre.,English
Lack of toilets at the market has affected people's businesses.,English
People shifted from the market because of health related issues.,English
The district has failed to ensure proper hygiene in the market.,English
The district health officers asserted that toilets will be constructed in the market.,English
The district lacks enough funds to effectively plan for the people.,English
The district obtained funds from the government.,English
Vendors should use the toilet at the municipal council.,English
There are increasing cases of gender-based violence in the district.,English
The magistrates court is overwhelmed by cases of gender-based violence.,English
People handling gender-based violence cases are biased.,English
Victims are fined with goats to handle their issues regarding gender based violence.,English
District leaders have discouraged gender based violence.,English
People should be united against gender-based violence.,English
The church encouraged people to love one another.,English
People should have common goals in society.,English
People have been convicted over cases of gender based violence.,English
The district carried out a massive community sensitization to reduce gender based violence.,English
The police arrested a man suspected of killing his wife.,English
The wife was killed over fifty thousand shillings.,English
The police doctor has made a medical report.,English
There was destruction of property.,English
Police is carrying out its investigations.,English
Couples should be united in their families.,English
There are few cases of domestic violence in Nebbi district.,English
The church has started providing counselling services to the people.,English
There are increasing cases of violence throughout Uganda.,English
Farmers should control their animals.,English
There is fruit growing in Nebbi district.,English
Fruits have been destroyed by the stray animals.,English
People have acquired income from selling fruits.,English
The district has failed to enforce its laws.,English
Stray animals have destroyed people's crops.,English
Farmers should keep their animals in simple houses.,English
Politicians should embrace the developments in the district.,English
The district enacted laws that provide how stray animals should be treated.,English
The government donated close to three billion to farmers in west Nile.,English
The district lobbied the funds from the government to enhance agricultural production.,English
"Farmers grow mangoes, apples, avocado and cocoa.",English
A fruit factory will be established in the area to process the agricultural products.,English
There are increasing cases of early pregnancies among girls.,English
The district should establish various programs to support the girl child.,English
Parents should understand the challenges faced by their children.,English
District leaders are lenient on rich business men who break law and order.,English
The police has failed to regulate the night discos.,English
People below eighteen years are not allowed to access video halls.,English
Families should participate in the fight against teenage pregnancies.,English
Children should be educated about the risks of early sex.,English
Men who engage in sexual activities with girls will be arrested.,English
Parents should protect children from bad habits.,English
Girls have pregnancy complications during delivery.,English
Youths should embrace practical skills to fight joblessness.,English
The district organized an entrepreneurial training session for the youths.,English
"The youths should be creative, innovative and inventive.",English
Youths should start up their own businesses.,English
People should work hard and improve their welfare.,English
People are only interested in white collar jobs.,English
Government set up youth livelihood programs to enable the youths participate in business activities.,English
Youths lack skills to manage the business environment.,English
Youths were given capital to start up small businesses.,English
"Youths are able to make liquid soap, shampoo and vaseline.",English
Most of the youths in the district are unemployed.,English
The district has given tax holidays to various businesses.,English
The police has arrested loggers.,English
The district will enforce environmental laws with an aim of conserving the environment.,English
The district has advised people to look out for alternative sources of energy.,English
People should embrace the use of biogas and solar energy.,English
There are high levels of deforestation in the district.,English
The district will provide solar energy in schools and hospitals.,English
Some women single handedly raise their children.,English
Women leaders help and support ferlow women in society.,English
What take some of the rights for mothers?,English
Do not bribe police officers.,English
Is it true that no one is above the law?,English
Some security officers engage in criminal acts.,English
Every paper money note has a unique serial number.,English
Women should give guidance to the young girls in society.,English
Honoring one another is important.,English
What are the roles executed by the Uganda National Roads Authority?,English
Road construction is very costly.,English
What happens in council meetings?,English
Members of parliament represent different regions of the country.,English
When can a by-election take place?,English
What role is played by members of parliament?,English
He was invited to attend the swearing in ceremony for new leaders.,English
Forward what you cannot handle to those that can.,English
Communication can be via a phone call.,English
Suspects are held in police custody.,English
Should suspects be disclosed to the public.,English
Cows are stolen for their meat.,English
What is the average cost of a cow?,English
Animals' rights should be respected.,English
How long can a criminal investigation last?,English
The calves were stolen from the kraal.,English
Thieves may most likely be killed by the mob.,English
Suspects are taken to court.,English
How can one's age be proved?,English
What has greatly influenced teenage pregnancies?,English
Women do not usually want to declare their true age.,English
Birth certificates are issued to parents after child birth.,English
How old is your eldest son?,English
"In some religions, children are baptized when they are still babies.",English
Are parents to blame for teenage pregnancy and child marriage?,English
How can parents influence their children's decisions early in life?,English
Parents should not allow their children to stay outside at night.,English
Children have a lot to learn from their parents.,English
Surprisingly she gave birth at fourteen years of age.,English
Corruption is almost everywhere?,English
Through investigative journalism a lot is brought to light.,English
Is it possible for a nation to be free from corruption?,English
Media should expose corrupt officials.,English
What is involved in the procurement process?,English
We have very many government corrupt officials in Uganda.,English
Corruption is one vice that continues to exist in society.,English
What kind of work do journalists do?,English
It is believed that two heads are better than one.,English
What is a legal regime?,English
What kind of skills should a journalist have?,English
Which company was given a tender for cleaning the market?,English
Is petty merchandise profitable?,English
The weather is sometimes very unpredictable.,English
What should be done for informal traders?,English
Money serves a lot of purposes.,English
Some people are rebellious in nature.,English
How often do traders pay market dues?,English
New markets promote trading activities.,English
Who is responsible for collecting local revenue?,English
Traders in the market pay tax.,English
What are the sources of local revenue?,English
"In places that do not have electricity, people have resorted to using solar.",English
"At school, we would read on solar lamps once electricity was off.",English
Too much light can affect your sight.,English
Solar is relatively cheap and affordable.,English
How much can a solar system cost?,English
Middle men always want to charge a higher price than the original.,English
Solar power is safer than electricity power.,English
Paraffin is highly flammable.,English
What is your best meal?,English
Some parents pack food for their children while going to school.,English
Are by-laws necessary?,English
Universal primary and secondary schools are cheaper than other schools.,English
What influences a child's performance at school?,English
Education adds value to you.,English
Some schools provide mid-day meals to students.,English
Who is responsible for providing students with food at school?,English
Children need to have meals at school.,English
Schools should provide food for all children at school.,English
Some parents can financially support their children in everything.,English
What are some of the family planning methods?,English
Of what benefit is family planning?,English
Very many children can be a burden to parents.,English
Parents no longer want to give birth to very many children.,English
Responsible parents look after their children.,English
Fornication is sin before God.,English
Parents are encouraged to use the different family planning methods.,English
What do youths consider as modernity?,English
What are the dangers of technology to society today?,English
Who is responsible for teaching children about sex education?,English
Why do health centers operate without medicine?,English
My uncle has been admitted to the hospital.,English
For any health related issues consult from the health workers.,English
Lack of medicine in hospitals has led people to resort to self-medication.,English
Customer care is key for businesses that are to last long in the market.,English
I want to go to the village.,English
Government drugs are issued at a free cost.,English
Most people purchase drugs from the pharmacy.,English
Hospitals must have drugs.,English
Under what conditions should a patient be referred to a hospital?,English
"With the help of medical drugs, health officers are able to treat patients.",English
Health workers should work hard to save lives.,English
Vegetables are rich in nutrients.,English
What are the signs and symptoms of a malnourished person?,English
When you eat foods rich in nutrients the body immunity is boosted.,English
Children need to feed well in order to grow well.,English
What brings about malnutrition?,English
Which foods are rich in nutrients?,English
We are taught in school that it is good to eat a balanced diet.,English
What role has been played by the government in the education sector?,English
Food is a basic need for man.,English
If you take days without eating food you might die..,English
Be mindful of your diet.,English
Pregnant mothers need to feed well .,English
What causes diabetes disease?,English
Farmers water their crops with a watering can.,English
What should be done to fight against malnutrition?,English
"Due to poor feeding, some children fail to perform well academically.",English
He was arrested because he was part of the mob that killed the thief.,English
Everyone's life matters.,English
Witch craft is an evil practice.,English
Avoid taking the law in your hands but rather report to the police.,English
Murder is punishable by law.,English
Who is the head of security in Uganda?,English
"Youths are more into crime, why?",English
He was killed on new year's day .,English
Traditional leaders can support government programs in one way or another.,English
Royals have easier access to the palace.,English
Crime can be prevented.,English
At what age do Bishops resign from ministry?,English
"In Christian faith, we are all brothers and sisters.",English
Leadership comes from God.,English
Who is in charge of appointing new bishops?,English
The pope is the chief pastor of the worldwide catholic church.,English
Let us continue to do the works of God.,English
Every leader is unique in his or her own way.,English
What are the qualities of a good shepherd?,English
God has great plans for our lives.,English
A good leader should be humble.,English
Bishops serve in the church.,English
On what date was your baby born?,English
When was the priest ordained?,English
"In some religions, religious leaders are just elected.",English
What happens at the catholic diocese?,English
Markets need to be built on a large piece of land.,English
At how much did you acquire your piece of land?,English
"If you borrow money, you have an obligation to pay it back.",English
What are some of the problems faced by traders?,English
Why do I need to have a land title?,English
Some problems can be solved in different ways.,English
Land can be acquired through purchase or inheritance.,English
I plan to buy a piece of land next year.,English
Availability of land influences development.,English
Why do people like to believe rumors?,English
Land can either be individually owned or communally owned.,English
Land owners need to hold land titles for security purposes.,English
Infrastructure like roads are for public use.,English
Some land is reserved for road construction.,English
When is a refund necessary?,English
We shall sell our family piece of land.,English
The manager shall have a dialogue with the contractors.,English
Buyers have a choice to buy whatever they want.,English
Very many people suffer due to ignorance.,English
Good roads ease transportation of goods to the market.,English
How can we ensure effective communication?,English
New leaders need training.,English
How long is a financial year?,English
What should be put into consideration when making a land deal?,English
Selfishness could result into greediness.,English
Some people enjoy going to the discos.,English
It is better for school going children not to go to discos.,English
What kind of music do you enjoy?,English
Public concerns are usually responded to by the rightful authorities.,English
One key objective for any business is to maintain its customers.,English
Bouncers are fond of having huge and large chests.,English
I enjoy dancing to music.,English
Children below the age of eighteen cannot legally access certain things.,English
Most discos operate at night.,English
Of what danger are discos?,English
People go to disco for leisure.,English
Over the weekend my friends shall go to the disco.,English
